{
  "authority": "advisory",
  "basis": {
    "algorithm_families": [
      "carrier",
      "header8",
      "escape_control",
      "chirality_fano",
      "a14_scheduling",
      "proposal_receipt",
      "activation_projection"
    ],
    "formula": "8x7x2",
    "lanes_per_role": 7,
    "proof_forms_per_lane": 2,
    "roles": 8
  },
  "control_plane_tools": {
    "basis": "bounded allowlisted control plane pages",
    "mcp_tools": [
      {
        "availability": "available",
        "name": "list_control_plane_pages"
      },
      {
        "availability": "available",
        "name": "get_control_plane_page"
      }
    ]
  },
  "replay_hash": "8a10828a6dd015316ff469b4303705c4e6f83f481b3eb895adc9120c82e4e9a0",
  "roles": [
    {
      "lane_agents": [
        {
          "agent_id": "metatron.transition",
          "algorithm_family": "carrier",
          "lane_id": "transition",
          "proof_assistants": [
            {
              "assistant_id": "metatron.transition.constructive",
              "cell_id": "Q1_A1_constructive",
              "proof_form": "constructive"
            },
            {
              "assistant_id": "metatron.transition.falsification",
              "cell_id": "Q1_A1_falsification",
              "proof_form": "falsification"
            }
          ],
          "toolset": {
            "basis": "dormant canonical artifact carrier",
            "mcp_tools": [
              {
                "availability": "planned",
                "name": "verify_artifact"
              },
              {
                "availability": "planned",
                "name": "decode_artifact"
              },
              {
                "availability": "planned",
                "name": "get_artifact_manifest"
              },
              {
                "availability": "planned",
                "name": "emit_aztec_projection"
              }
            ]
          }
        },
        {
          "agent_id": "metatron.control",
          "algorithm_family": "header8",
          "lane_id": "control",
          "proof_assistants": [
            {
              "assistant_id": "metatron.control.constructive",
              "cell_id": "Q1_A2_constructive",
              "proof_form": "constructive"
            },
            {
              "assistant_id": "metatron.control.falsification",
              "cell_id": "Q1_A2_falsification",
              "proof_form": "falsification"
            }
          ],
          "toolset": {
            "basis": "atomic unit/stream interpretation",
            "mcp_tools": [
              {
                "availability": "planned",
                "name": "interpret_header8_stream"
              },
              {
                "availability": "planned",
                "name": "verify_header8_stream"
              },
              {
                "availability": "planned",
                "name": "classify_structural"
              },
              {
                "availability": "planned",
                "name": "classify_block"
              }
            ]
          }
        },
        {
          "agent_id": "metatron.projection",
          "algorithm_family": "activation_projection",
          "lane_id": "projection",
          "proof_assistants": [
            {
              "assistant_id": "metatron.projection.constructive",
              "cell_id": "Q1_A3_constructive",
              "proof_form": "constructive"
            },
            {
              "assistant_id": "metatron.projection.falsification",
              "cell_id": "Q1_A3_falsification",
              "proof_form": "falsification"
            }
          ],
          "toolset": {
            "basis": "advisory local views from dormant carrier",
            "mcp_tools": [
              {
                "availability": "planned",
                "name": "activate_artifact"
              },
              {
                "availability": "planned",
                "name": "get_projection_view"
              },
              {
                "availability": "planned",
                "name": "verify_projection_view"
              },
              {
                "availability": "planned",
                "name": "get_world_projection"
              },
              {
                "availability": "planned",
                "name": "get_world_state"
              },
              {
                "availability": "planned",
                "name": "verify_world"
              }
            ]
          }
        },
        {
          "agent_id": "metatron.escape",
          "algorithm_family": "escape_control",
          "lane_id": "escape",
          "proof_assistants": [
            {
              "assistant_id": "metatron.escape.constructive",
              "cell_id": "Q1_A4_constructive",
              "proof_form": "constructive"
            },
            {
              "assistant_id": "metatron.escape.falsification",
              "cell_id": "Q1_A4_falsification",
              "proof_form": "falsification"
            }
          ],
          "toolset": {
            "basis": "bounded scoped interpretation",
            "mcp_tools": [
              {
                "availability": "planned",
                "name": "enter_escape_scope"
              },
              {
                "availability": "planned",
                "name": "close_escape_scope"
              },
              {
                "availability": "planned",
                "name": "validate_escape_scope"
              },
              {
                "availability": "planned",
                "name": "reject_invalid_escape"
              }
            ]
          }
        },
        {
          "agent_id": "metatron.chirality",
          "algorithm_family": "chirality_fano",
          "lane_id": "chirality",
          "proof_assistants": [
            {
              "assistant_id": "metatron.chirality.constructive",
              "cell_id": "Q1_A5_constructive",
              "proof_form": "constructive"
            },
            {
              "assistant_id": "metatron.chirality.falsification",
              "cell_id": "Q1_A5_falsification",
              "proof_form": "falsification"
            }
          ],
          "toolset": {
            "basis": "canonical ordering over partitions",
            "mcp_tools": [
              {
                "availability": "planned",
                "name": "partition_candidate_set"
              },
              {
                "availability": "planned",
                "name": "kernel_bit"
              },
              {
                "availability": "planned",
                "name": "chirality_select"
              },
              {
                "availability": "planned",
                "name": "verify_order_invariance"
              }
            ]
          }
        },
        {
          "agent_id": "metatron.proposal",
          "algorithm_family": "proposal_receipt",
          "lane_id": "proposal",
          "proof_assistants": [
            {
              "assistant_id": "metatron.proposal.constructive",
              "cell_id": "Q1_A6_constructive",
              "proof_form": "constructive"
            },
            {
              "assistant_id": "metatron.proposal.falsification",
              "cell_id": "Q1_A6_falsification",
              "proof_form": "falsification"
            }
          ],
          "toolset": {
            "basis": "proposal-first mutation boundary",
            "mcp_tools": [
              {
                "availability": "planned",
                "name": "create_proposal"
              },
              {
                "availability": "planned",
                "name": "accept_proposal"
              },
              {
                "availability": "planned",
                "name": "reject_proposal"
              },
              {
                "availability": "planned",
                "name": "emit_receipt"
              },
              {
                "availability": "planned",
                "name": "verify_receipt_lineage"
              },
              {
                "availability": "planned",
                "name": "step_world"
              }
            ]
          }
        },
        {
          "agent_id": "metatron.reconcile",
          "algorithm_family": "a14_scheduling",
          "lane_id": "reconcile",
          "proof_assistants": [
            {
              "assistant_id": "metatron.reconcile.constructive",
              "cell_id": "Q1_A7_constructive",
              "proof_form": "constructive"
            },
            {
              "assistant_id": "metatron.reconcile.falsification",
              "cell_id": "Q1_A7_falsification",
              "proof_form": "falsification"
            }
          ],
          "toolset": {
            "basis": "eligibility and bounded runtime scheduling",
            "mcp_tools": [
              {
                "availability": "planned",
                "name": "get_incidence_schedule_snapshot"
              },
              {
                "availability": "planned",
                "name": "compute_eligibility"
              },
              {
                "availability": "planned",
                "name": "schedule_agent_step"
              },
              {
                "availability": "planned",
                "name": "check_tick_budget"
              }
            ]
          }
        }
      ],
      "priority_band": "critical",
      "question_id": "Q1",
      "question_slug": "source_of_truth",
      "role_id": "metatron"
    },
    {
      "lane_agents": [
        {
          "agent_id": "enoch.transition",
          "algorithm_family": "carrier",
          "lane_id": "transition",
          "proof_assistants": [
            {
              "assistant_id": "enoch.transition.constructive",
              "cell_id": "Q2_A1_constructive",